{"$id":"https://awesome-theorems.invalid/schemas/stage5-theorem-claim-card-1.1.json","$schema":"https://json-schema.org/draft/2020-12/schema","additionalProperties":false,"properties":{"artifact_policy":{"additionalProperties":false,"properties":{"allowed_paths":{"items":{"minLength":1,"type":"string"},"minItems":1,"type":"array","uniqueItems":true},"forbidden_paths":{"items":{"minLength":1,"type":"string"},"minItems":1,"type":"array","uniqueItems":true},"required_paths":{"items":{"minLength":1,"type":"string"},"minItems":1,"type":"array","uniqueItems":true}},"required":["allowed_paths","required_paths","forbidden_paths"],"type":"object"},"baseline":{"additionalProperties":false,"properties":{"blueprint_sha256":{"minLength":1,"pattern":"^[0-9a-f]{64}$","type":"string"},"dependency_state_sha256":{"minLength":1,"pattern":"^[0-9a-f]{64}$","type":"string"},"execution_spec_sha256":{"minLength":1,"pattern":"^[0-9a-f]{64}$","type":"string"},"owned_paths_baseline_sha256":{"minLength":1,"pattern":"^[0-9a-f]{64}$","type":"string"},"source_bundle_sha256":{"minLength":1,"pattern":"^[0-9a-f]{64}$","type":"string"}},"required":["execution_spec_sha256","blueprint_sha256","source_bundle_sha256","dependency_state_sha256","owned_paths_baseline_sha256"],"type":"object"},"canonical_repository_root":{"minLength":1,"type":"string"},"canonical_write_policy":{"const":"forbidden","minLength":1,"type":"string"},"claim_id":{"minLength":1,"pattern":"^[A-Za-z0-9][A-Za-z0-9._:@-]{0,199}$","type":"string"},"deadline":{"format":"date-time","minLength":1,"pattern":"^.+Z$","type":"string"},"deliverable":{"minLength":1,"type":"string"},"dependencies":{"items":{"minLength":1,"pattern":"^[A-Za-z0-9][A-Za-z0-9._:@-]{0,199}$","type":"string"},"type":"array","uniqueItems":true},"execution_identity":{"additionalProperties":false,"properties":{"execution_spec_sha256":{"minLength":1,"pattern":"^[0-9a-f]{64}$","type":"string"},"generation_id":{"minLength":1,"pattern":"^[A-Za-z0-9][A-Za-z0-9._:@-]{0,199}$","type":"string"},"lane_id":{"minLength":1,"pattern":"^[A-Za-z0-9][A-Za-z0-9._:@-]{0,199}$","type":"string"},"prompt_digest":{"minLength":1,"pattern":"^[0-9a-f]{64}$","type":"string"},"prompt_epoch":{"minLength":1,"pattern":"^[A-Za-z0-9][A-Za-z0-9._:@-]{0,199}$","type":"string"},"requested_concurrency":{"additionalProperties":false,"properties":{"agent_executions":{"minimum":1,"type":"integer"},"authenticated_goals":{"minimum":1,"type":"integer"},"exact_path_conflicts":{"minimum":0,"type":"integer"},"in_flight_requests":{"minimum":1,"type":"integer"},"integration":{"minimum":1,"type":"integer"},"launch_fanout_per_wave":{"minimum":1,"type":"integer"},"live_transports":{"minimum":1,"type":"integer"},"logical_claims":{"minimum":1,"type":"integer"},"outbound_request_starts_per_window":{"minimum":1,"type":"integer"},"running_turns":{"minimum":1,"type":"integer"},"service_records":{"const":"not_applicable","minLength":1,"type":"string"},"startup_reservations":{"minimum":1,"type":"integer"},"validators":{"minimum":1,"type":"integer"}},"required":["logical_claims","service_records","agent_executions","startup_reservations","launch_fanout_per_wave","live_transports","authenticated_goals","running_turns","outbound_request_starts_per_window","in_flight_requests","integration","validators","exact_path_conflicts"],"type":"object"},"resolved_concurrency":{"additionalProperties":false,"properties":{"agent_executions":{"minimum":1,"type":"integer"},"authenticated_goals":{"minimum":1,"type":"integer"},"exact_path_conflicts":{"minimum":0,"type":"integer"},"in_flight_requests":{"minimum":1,"type":"integer"},"integration":{"minimum":1,"type":"integer"},"launch_fanout_per_wave":{"minimum":1,"type":"integer"},"live_transports":{"minimum":1,"type":"integer"},"logical_claims":{"minimum":1,"type":"integer"},"outbound_request_starts_per_window":{"minimum":1,"type":"integer"},"running_turns":{"minimum":1,"type":"integer"},"service_records":{"const":"not_applicable","minLength":1,"type":"string"},"startup_reservations":{"minimum":1,"type":"integer"},"validators":{"minimum":1,"type":"integer"}},"required":["logical_claims","service_records","agent_executions","startup_reservations","launch_fanout_per_wave","live_transports","authenticated_goals","running_turns","outbound_request_starts_per_window","in_flight_requests","integration","validators","exact_path_conflicts"],"type":"object"}},"required":["lane_id","generation_id","prompt_epoch","prompt_digest","execution_spec_sha256","requested_concurrency","resolved_concurrency"],"type":"object"},"execution_policy":{"additionalProperties":false,"properties":{"execution_limits":{"additionalProperties":false,"properties":{"cpu_seconds":{"minimum":1,"type":"integer"},"external_launches":{"minimum":1,"type":"integer"},"generation_lifetime_seconds":{"const":1209600,"minimum":1,"type":"integer"},"model_input_tokens":{"minimum":1,"type":"integer"},"model_output_tokens":{"minimum":1,"type":"integer"},"model_turns":{"const":"unbounded","minLength":1,"type":"string"}},"required":["generation_lifetime_seconds","model_input_tokens","model_output_tokens","model_turns","cpu_seconds","external_launches"],"type":"object"},"recovery":{"additionalProperties":false,"properties":{"backoff_initial_seconds":{"const":60,"minimum":1,"type":"integer"},"backoff_jitter_ratio":{"maximum":0.2,"minimum":0,"type":"number"},"backoff_max_seconds":{"const":3600,"minimum":1,"type":"integer"},"backoff_multiplier":{"const":2,"minimum":1,"type":"integer"},"breaker_cooldown_seconds":{"const":1800,"minimum":1,"type":"integer"},"breaker_failure_classes":{"items":{"minLength":1,"type":"string"},"minItems":1,"type":"array","uniqueItems":true},"breaker_failure_threshold":{"const":3,"minimum":1,"type":"integer"},"breaker_scope":{"const":"provider","minLength":1,"type":"string"},"generation_replacements_per_work_item":{"const":60,"minimum":1,"type":"integer"},"provider_attempts_per_request":{"minimum":1,"type":"integer"},"repair_attempts_per_failure_identity":{"minimum":1,"type":"integer"},"retry_after_precedence":{"const":"provider_retry_after_then_exponential","minLength":1,"type":"string"},"startup_attempts_per_generation":{"minimum":1,"type":"integer"}},"required":["startup_attempts_per_generation","provider_attempts_per_request","repair_attempts_per_failure_identity","generation_replacements_per_work_item","backoff_initial_seconds","backoff_max_seconds","backoff_multiplier","backoff_jitter_ratio","retry_after_precedence","breaker_failure_classes","breaker_scope","breaker_failure_threshold","breaker_cooldown_seconds"],"type":"object"}},"required":["execution_limits","recovery"],"type":"object"},"generation_lineage":{"additionalProperties":false,"properties":{"previous_generation_id":{"type":["string","null"]},"replacement_cap":{"const":60,"minimum":1,"type":"integer"},"replacement_ordinal":{"maximum":60,"minimum":0,"type":"integer"}},"required":["replacement_ordinal","replacement_cap","previous_generation_id"],"type":"object"},"item_id":{"minLength":1,"pattern":"^[A-Za-z0-9][A-Za-z0-9._:@-]{0,199}$","type":"string"},"mode":{"minLength":1,"pattern":"^[A-Z][A-Z0-9-]{0,63}$","type":"string"},"program":{"minLength":1,"type":"string"},"read_only_bootstrap_files":{"items":{"additionalProperties":false,"properties":{"path":{"minLength":1,"type":"string"},"sha256":{"minLength":1,"pattern":"^[0-9a-f]{64}$","type":"string"},"size_bytes":{"minimum":0,"type":"integer"}},"required":["path","sha256","size_bytes"],"type":"object"},"minItems":1,"type":"array","uniqueItems":true},"resource_budget":{"additionalProperties":false,"properties":{"cpu_seconds":{"minimum":1,"type":"integer"},"external_launches":{"minimum":1,"type":"integer"},"model_input_tokens":{"minimum":1,"type":"integer"},"model_output_tokens":{"minimum":1,"type":"integer"},"model_turns":{"const":"unbounded","minLength":1,"type":"string"},"wall_seconds":{"minimum":1,"type":"integer"}},"required":["model_input_tokens","model_output_tokens","model_turns","external_launches","wall_seconds","cpu_seconds"],"type":"object"},"result_schema":{"additionalProperties":false,"properties":{"path":{"const":"Docs/evidence/stage5_theorems/worker-result.schema.json","minLength":1,"type":"string"},"schema_id":{"const":"https://awesome-theorems.invalid/schemas/stage5-theorem-worker-result-1.0.json","minLength":1,"type":"string"},"sha256":{"const":"ceaba4fa8819c84a2507223a7126651e0f9728a3a6a94cd5eacbb88a151036c4","minLength":1,"pattern":"^[0-9a-f]{64}$","type":"string"}},"required":["path","schema_id","sha256"],"type":"object"},"retry_budget":{"additionalProperties":false,"properties":{"attempt":{"minimum":1,"type":"integer"},"max_attempts":{"minimum":1,"type":"integer"}},"required":["attempt","max_attempts"],"type":"object"},"run_id":{"minLength":1,"pattern":"^[A-Za-z0-9][A-Za-z0-9._:@-]{0,199}$","type":"string"},"schema_version":{"const":"awesome-theorems/stage5-proof-debt-claim-card/1.1","minLength":1,"type":"string"},"task_root":{"minLength":1,"type":"string"},"validation_commands":{"items":{"additionalProperties":false,"properties":{"argv":{"items":{"minLength":1,"type":"string"},"minItems":1,"type":"array"},"command_id":{"minLength":1,"pattern":"^[A-Za-z0-9][A-Za-z0-9._:@-]{0,199}$","type":"string"},"cwd":{"minLength":1,"type":"string"},"environment":{"items":{"additionalProperties":false,"properties":{"name":{"minLength":1,"pattern":"^[A-Za-z_][A-Za-z0-9_]*$","type":"string"},"value":{"type":"string"}},"required":["name","value"],"type":"object"},"type":"array","uniqueItems":true},"network":{"enum":["denied","allowed_by_policy"],"minLength":1,"type":"string"},"timeout_seconds":{"minimum":1,"type":"integer"}},"required":["command_id","cwd","argv","environment","timeout_seconds","network"],"type":"object"},"minItems":1,"type":"array","uniqueItems":true},"writable_paths":{"items":{"minLength":1,"type":"string"},"minItems":1,"type":"array","uniqueItems":true}},"required":["schema_version","program","claim_id","run_id","item_id","mode","dependencies","baseline","deadline","task_root","canonical_repository_root","canonical_write_policy","writable_paths","read_only_bootstrap_files","deliverable","validation_commands","artifact_policy","result_schema","resource_budget","retry_budget","execution_identity","execution_policy","generation_lineage"],"type":"object"}