{
  "artifact_policy": {
    "allowed_paths": [
      "Stage5_Theorem_Instances/S5-CLM-00003556/intake.json",
      "Formalizations/Lean/AwesomeTheorems/Stage5/Theorems/S5_CLM_00003556/Statement.lean",
      "Stage5_Theorem_Instances/S5-CLM-00003556/statement-crosswalk.json",
      "Stage5_Theorem_Instances/S5-CLM-00003556/anchor-audit.json",
      "Stage5_Theorem_Instances/S5-CLM-00003556/proof-units.json",
      "Stage5_Theorem_Instances/S5-CLM-00003556/process-audit.md",
      "Formalizations/Lean/AwesomeTheorems/Stage5/Theorems/S5_CLM_00003556/Proof.lean",
      "Stage5_Theorem_Instances/S5-CLM-00003556/machine-closure.json",
      "Stage5_Theorem_Instances/S5-CLM-00003556/machine-checked-audit.md",
      "Stage5_Theorem_Instances/S5-CLM-00003556/proof-outline.md",
      "Stage5_Theorem_Instances/S5-CLM-00003556/full-study.md",
      "Stage5_Theorem_Instances/S5-CLM-00003556/readability-review.json",
      "Formalizations/Lean/AwesomeTheorems/Stage5/Theorems/S5_CLM_00003556/Audit.lean",
      "Stage5_Theorem_Instances/S5-CLM-00003556/build-validation.md",
      "Stage5_Theorem_Instances/S5-CLM-00003556/receipts/current-validation.json",
      "Stage5_Theorem_Instances/S5-CLM-00003556/README.md",
      "Stage5_Theorem_Instances/S5-CLM-00003556/meta.json",
      "Stage5_Theorem_Instances/S5-CLM-00003556/receipts/release-decision.json"
    ],
    "forbidden_paths": [
      "Docs/Stage5_Theorems_Blueprint.md",
      "Docs/Stage5_Theorems_Gantt.md",
      "Docs/catalog",
      ".git",
      ".ops"
    ],
    "required_paths": [
      "Stage5_Theorem_Instances/S5-CLM-00003556/intake.json",
      "Formalizations/Lean/AwesomeTheorems/Stage5/Theorems/S5_CLM_00003556/Statement.lean",
      "Stage5_Theorem_Instances/S5-CLM-00003556/statement-crosswalk.json",
      "Stage5_Theorem_Instances/S5-CLM-00003556/anchor-audit.json",
      "Stage5_Theorem_Instances/S5-CLM-00003556/proof-units.json",
      "Stage5_Theorem_Instances/S5-CLM-00003556/process-audit.md",
      "Formalizations/Lean/AwesomeTheorems/Stage5/Theorems/S5_CLM_00003556/Proof.lean",
      "Stage5_Theorem_Instances/S5-CLM-00003556/machine-closure.json",
      "Stage5_Theorem_Instances/S5-CLM-00003556/machine-checked-audit.md",
      "Stage5_Theorem_Instances/S5-CLM-00003556/proof-outline.md",
      "Stage5_Theorem_Instances/S5-CLM-00003556/full-study.md",
      "Stage5_Theorem_Instances/S5-CLM-00003556/readability-review.json",
      "Formalizations/Lean/AwesomeTheorems/Stage5/Theorems/S5_CLM_00003556/Audit.lean",
      "Stage5_Theorem_Instances/S5-CLM-00003556/build-validation.md",
      "Stage5_Theorem_Instances/S5-CLM-00003556/receipts/current-validation.json",
      "Stage5_Theorem_Instances/S5-CLM-00003556/README.md",
      "Stage5_Theorem_Instances/S5-CLM-00003556/meta.json",
      "Stage5_Theorem_Instances/S5-CLM-00003556/receipts/release-decision.json"
    ]
  },
  "baseline": {
    "blueprint_sha256": "95b2a3034a5ebf7f651c81a5fca4ae980f79efbabb7e3a425de7142248c52943",
    "dependency_state_sha256": "7a8ff40f4d9f8cd62e70435853e89d1eb6ae822ccbd549c00780311d84a2c8ae",
    "execution_spec_sha256": "1e183fb35791d92b9845761bc95fe8db3525eaa66172879ce9d407e5894dec61",
    "owned_paths_baseline_sha256": "40396cfd597c8899e8ff7b1bfa29cdc04a81e4a46c6159865af53881f0f14dfb",
    "source_bundle_sha256": "9fc1f215e6f6453659926ffd9e460f0f208d26c45b6b618e4b53fec8403f7cd1"
  },
  "canonical_repository_root": "/home/sansha/Github/awesome_theorems",
  "canonical_write_policy": "forbidden",
  "claim_id": "S5THM-00003556-TARGET--worker",
  "deadline": "2026-09-03T02:49:15Z",
  "deliverable": "S5-CLM-00003556 complete theorem package [FC-SORRY] — one isolated tmux and one /goal. Exactly one logical TARGET owns this theorem, and it has at most one live worker generation. Every generation owns a fresh task root, task-local tmux server/socket/session, private writable CODEX_HOME, interactive Codex TUI process tree, thread and exactly one submitted /goal; generations never overlap and no generation may inspect another task root or claim another mathematical ID. The current active goal completes the target-local INTAKE, STATEMENT, ANCHOR, TREE, MACHINE, READABLE, VALIDATE and RELEASE sub-checklist. The durable handoff must bind the exact frozen record and Stage6 alias; the Master-recomputed elaborated root expression and transitive non-foundation constant environment by provider declaration/type/body/source/revision hashes; a bidirectional crosswalk; content-addressed human and machine anchors; a complete typed proof/composition/provenance/trust/readability DAG; exact-root M0-L/W/P Lean closure without placeholders, unsafe injection, claim-specific axioms or unreviewed bodyless oracles; total injective node-to-fragment readable reconstruction with reverse coverage; clean cold from-source offline replay; semantic-substitution mutations; and a strict-dominance certificate over the pinned incomplete THM-M-0387 negative fixture. Local definitions, abbrevs, notation, syntax, macros, coercions, aliases or import substitutions may not shadow or reinterpret source symbols; text-identical theorem headers and self-attested hashes do not establish semantic identity. Distilled output removes duplication, never hypotheses, inference steps, outputs, formal anchors, downstream uses, exceptional cases or trust boundaries. Old phase or generation artifacts are usable only after controller harvest and explicit claim-local rematerialization; workers never read predecessor/sibling task roots directly. The canonical Master, outside the worker tmux, independently validates integrated bytes and alone advances underscore to x; only simultaneous exact semantic binding, M0, R0, empty H/M/R cut sets, current trace and strict dominance permit theorem_complete. Worker validation is the task-local --no-lean semantic/evidence preflight only: do not invoke Lean, Lake or Elan; do not clone, fetch or reconstruct any repository; and never inspect canonical_repository_root. Use only the immutable read_only_bootstrap_files, including pinned provider-sources, plus this generation's writable_paths. Master alone performs provider-native trust-zero Lean compilation after harvest. Read `_baseline/provider-kernel-route.json`: every Statement.lean, Proof.lean and Audit.lean must actively import its exact `lean_module` and reference its exact `qualified_declaration` (comments do not count). Audit.lean must include the kernel-checkable witness `example : type_of% <qualified_declaration> := <claim-owned machine root>` and `#print axioms <claim-owned machine root>`. Independently prove that root without an oracle or the provider proof body; Master selects the sealed provider-native toolchain/environment and rejects any fallback, substitution, `sorryAx`, or custom axiom.",
  "dependencies": [
    "S5THM-BOOT-001"
  ],
  "execution_identity": {
    "execution_spec_sha256": "1e183fb35791d92b9845761bc95fe8db3525eaa66172879ce9d407e5894dec61",
    "generation_id": "r-1787194154-e9609f19",
    "lane_id": "S5THM-00003556-TARGET",
    "prompt_digest": "e5496f08d0123c951fad754738ecd0d5e1d4d58786695ac1554e646a240005e9",
    "prompt_epoch": "stage5-concurrency-prompt-2026-08-17-24-sol-default-subagents-4",
    "requested_concurrency": {
      "agent_executions": 24,
      "authenticated_goals": 24,
      "exact_path_conflicts": 0,
      "in_flight_requests": 24,
      "integration": 1,
      "launch_fanout_per_wave": 4,
      "live_transports": 24,
      "logical_claims": 24,
      "outbound_request_starts_per_window": 24,
      "running_turns": 24,
      "service_records": "not_applicable",
      "startup_reservations": 24,
      "validators": 4
    },
    "resolved_concurrency": {
      "agent_executions": 24,
      "authenticated_goals": 24,
      "exact_path_conflicts": 0,
      "in_flight_requests": 24,
      "integration": 1,
      "launch_fanout_per_wave": 4,
      "live_transports": 24,
      "logical_claims": 24,
      "outbound_request_starts_per_window": 24,
      "running_turns": 24,
      "service_records": "not_applicable",
      "startup_reservations": 24,
      "validators": 4
    }
  },
  "execution_policy": {
    "execution_limits": {
      "cpu_seconds": 1209600,
      "external_launches": 4,
      "generation_lifetime_seconds": 1209600,
      "model_input_tokens": 2000000,
      "model_output_tokens": 500000,
      "model_turns": "unbounded"
    },
    "recovery": {
      "backoff_initial_seconds": 60,
      "backoff_jitter_ratio": 0.2,
      "backoff_max_seconds": 3600,
      "backoff_multiplier": 2,
      "breaker_cooldown_seconds": 1800,
      "breaker_failure_classes": [
        "http_429",
        "http_503",
        "provider_unavailable"
      ],
      "breaker_failure_threshold": 3,
      "breaker_scope": "provider",
      "generation_replacements_per_work_item": 60,
      "provider_attempts_per_request": 60,
      "repair_attempts_per_failure_identity": 3,
      "retry_after_precedence": "provider_retry_after_then_exponential",
      "startup_attempts_per_generation": 1
    }
  },
  "generation_lineage": {
    "previous_generation_id": "r-1787189719-6e901f86",
    "replacement_cap": 60,
    "replacement_ordinal": 24
  },
  "item_id": "S5THM-00003556-TARGET",
  "mode": "TARGET-TARGET",
  "program": "stage5-theorem-proof-debt/2.0",
  "read_only_bootstrap_files": [
    {
      "path": "_baseline/Stage5_Theorems_Blueprint.md",
      "sha256": "95b2a3034a5ebf7f651c81a5fca4ae980f79efbabb7e3a425de7142248c52943",
      "size_bytes": 12188310
    },
    {
      "path": "_baseline/check_stage5_theorem_item.py",
      "sha256": "de35f108f4406e6daf0c252b892b9e6977f9ab5863159fa0e18bb703f1a47e97",
      "size_bytes": 43181
    },
    {
      "path": "_baseline/check_stage5_theorem_program_item.py",
      "sha256": "e9bc55eeef30addaef202c5707d171fdcbc8ed6f53394f98851c73805df991e1",
      "size_bytes": 7411
    },
    {
      "path": "_baseline/claim-card.schema.json",